<?xml version="1.0" encoding="us-ascii"?>

<!DOCTYPE formView SYSTEM "formView.dtd">

<formView>
  <title>New SIM</title>

  <info>
    <supportsNew>true</supportsNew>
  </info>

  <key>
    <tableName>sim</tableName>
    <columnName>obsid</columnName>
  </key>

  <navigation>
    <display>
      <name>Observation ID</name>
      <tableName>sim</tableName>
      <columnName>obsid</columnName>
    </display>
  </navigation>

  <GUI>
    <obsidcombobox tag="11">
      <labelText>Obs ID</labelText>
      <size>6</size>
      <row>
        <number>0</number>
      </row>
      <column>
        <number>0</number>
      </column>
      <database>
        <tableName>sim</tableName>
        <columnName>obsid</columnName>
	<queryString>SELECT target.obsid FROM target WHERE NOT EXISTS (SELECT 1 FROM locked WHERE locked.obsid = target.obsid) AND NOT EXISTS (SELECT 1 FROM sim WHERE sim.obsid = target.obsid)</queryString>
      </database>
    </obsidcombobox>
    
    <textfield tag="12">
      <labelText>Trans Offset</labelText>
      <size>8</size>
      <database>
        <tableName>sim</tableName>
        <columnName>trans_offset</columnName>
      </database>
    </textfield>
    
    <textfield tag="21">
      <labelText>Focus Offset</labelText>
      <size>8</size>
      <database>
        <tableName>sim</tableName>
        <columnName>focus_offset</columnName>
      </database>
    </textfield>

  </GUI>

</formView>
